{
  "schema": "cubed-core/clip-ble-ground-truth-v1",
  "schema_version": 1,
  "tag": "gtD1s",
  "cube": {
    "model": "GAN 12 ui",
    "link": "ble",
    "note": "The cube model was already public in this repository: the released calibration_gan12.json is documented as the gtD1s demo cube's six-color calibration."
  },
  "clip": {
    "filename": "gtD1s_decoder-demo-clip_f3919-f9722.mp4",
    "sha256": "7329c9b3c46007f618b043a61ee00b34c56c74aa22b8a803270c6ea4c9013776",
    "bytes": 41578973,
    "frame_count": 5804,
    "fps": 120.0207,
    "source_first_frame": 3919,
    "source_last_frame": 9722
  },
  "frame_index": {
    "basis": "clip-local",
    "origin_note": "clip_frame = source_frame - 3919; frame 0 is the clip's first frame",
    "first_move_frame": 120,
    "last_move_frame": 5563,
    "motion_frame_note": "moves[].frame is the reconstruction onset series, which covers all 91 moves. moves[].motion_frame is an independent motion-snapped index that exists for the first 88 moves only and disagrees with frame on 6 of them (largest disagreement 10 frames). Neither series is a hand-labelled frame; both are estimates."
  },
  "solve": {
    "scramble": "R' L2 F L2 U R D F' U2 L B2 D2 F2 L2 B2 R2 U F2 B2 L2 D",
    "move_count": 91,
    "solve_ms": 77847,
    "mode": "solve",
    "move_metric": "quarter-turn",
    "start_state_source": "solve_only_variant of gtD1 @move-b (scramble-prefix stripped for product-faithful eval)"
  },
  "time_to_frame": {
    "form": "clip_frame = round(slope_frames_per_ms * t_ms + intercept_frames)",
    "slope_frames_per_ms": 0.11975690133,
    "intercept_frames": -3678.759018,
    "fitted_on": "the 91 verified move onsets in this artifact",
    "residual_max_frames": 8.244,
    "residual_rms_frames": 2.815,
    "note": "Least-squares fit only. Per-move onsets are locally refined, so this global line does not reproduce them exactly. Use moves[].frame for move timing; the fit exists to place orientation samples, which have no independently refined frame index."
  },
  "moves": [
    {
      "index": 0,
      "frame": 120,
      "t_ms": 31722,
      "move": "U",
      "quat": [
        -0.64095,
        -0.253212,
        -0.716605,
        0.107334
      ],
      "quality": {
        "tier": "B",
        "snr": null,
        "neighbor_gap": 58,
        "snapped": false
      },
      "motion_frame": 120,
      "ble_reported_state_index": 0
    },
    {
      "index": 1,
      "frame": 178,
      "t_ms": 32221,
      "move": "F",
      "quat": [
        -0.615253,
        -0.293069,
        -0.721885,
        0.119907
      ],
      "quality": {
        "tier": "A",
        "snr": 9.677778,
        "neighbor_gap": 34,
        "snapped": true
      },
      "motion_frame": 178,
      "ble_reported_state_index": 1
    },
    {
      "index": 2,
      "frame": 212,
      "t_ms": 32493,
      "move": "L",
      "quat": [
        -0.810755,
        -0.188116,
        -0.528794,
        0.166234
      ],
      "quality": {
        "tier": "A",
        "snr": 4.106239,
        "neighbor_gap": 34,
        "snapped": true
      },
      "motion_frame": 212,
      "ble_reported_state_index": 1
    },
    {
      "index": 3,
      "frame": 252,
      "t_ms": 32809,
      "move": "B'",
      "quat": [
        -0.862056,
        -0.200446,
        -0.421491,
        0.197363
      ],
      "quality": {
        "tier": "A",
        "snr": 9.65625,
        "neighbor_gap": 40,
        "snapped": true
      },
      "motion_frame": 252,
      "ble_reported_state_index": 3
    },
    {
      "index": 4,
      "frame": 363,
      "t_ms": 33747,
      "move": "L'",
      "quat": [
        -0.851375,
        -0.22663,
        -0.443892,
        0.163366
      ],
      "quality": {
        "tier": "B",
        "snr": null,
        "neighbor_gap": 83,
        "snapped": false
      },
      "motion_frame": 363,
      "ble_reported_state_index": 3
    },
    {
      "index": 5,
      "frame": 446,
      "t_ms": 34467,
      "move": "B'",
      "quat": [
        -0.4691,
        -0.771111,
        -0.235878,
        -0.360057
      ],
      "quality": {
        "tier": "A",
        "snr": 10.754636,
        "neighbor_gap": 39,
        "snapped": true
      },
      "motion_frame": 446,
      "ble_reported_state_index": 5
    },
    {
      "index": 6,
      "frame": 485,
      "t_ms": 34782,
      "move": "B'",
      "quat": [
        -0.409497,
        -0.819758,
        -0.228645,
        -0.328623
      ],
      "quality": {
        "tier": "A",
        "snr": 3.147343,
        "neighbor_gap": 33,
        "snapped": true
      },
      "motion_frame": 485,
      "ble_reported_state_index": 5
    },
    {
      "index": 7,
      "frame": 518,
      "t_ms": 35012,
      "move": "D'",
      "quat": [
        -0.35786,
        -0.845149,
        -0.295541,
        -0.265053
      ],
      "quality": {
        "tier": "A",
        "snr": 6.779976,
        "neighbor_gap": 33,
        "snapped": true
      },
      "motion_frame": 518,
      "ble_reported_state_index": 7
    },
    {
      "index": 8,
      "frame": 568,
      "t_ms": 35459,
      "move": "R",
      "quat": [
        -0.397748,
        -0.817652,
        -0.259896,
        -0.325053
      ],
      "quality": {
        "tier": "A",
        "snr": 5.54733,
        "neighbor_gap": 16,
        "snapped": true
      },
      "motion_frame": 569,
      "ble_reported_state_index": 7
    },
    {
      "index": 9,
      "frame": 585,
      "t_ms": 35637,
      "move": "R",
      "quat": [
        -0.376019,
        -0.830103,
        -0.275307,
        -0.306162
      ],
      "quality": {
        "tier": "A",
        "snr": 9.620281,
        "neighbor_gap": 16,
        "snapped": true
      },
      "motion_frame": 585,
      "ble_reported_state_index": 7
    },
    {
      "index": 10,
      "frame": 813,
      "t_ms": 37485,
      "move": "L",
      "quat": [
        -0.493393,
        -0.671865,
        -0.500656,
        -0.233375
      ],
      "quality": {
        "tier": "A",
        "snr": 9.561996,
        "neighbor_gap": 33,
        "snapped": true
      },
      "motion_frame": 813,
      "ble_reported_state_index": 10
    },
    {
      "index": 11,
      "frame": 846,
      "t_ms": 37803,
      "move": "B'",
      "quat": [
        -0.653493,
        -0.484787,
        -0.532273,
        -0.233558
      ],
      "quality": {
        "tier": "A",
        "snr": 10.754636,
        "neighbor_gap": 31,
        "snapped": true
      },
      "motion_frame": 846,
      "ble_reported_state_index": 10
    },
    {
      "index": 12,
      "frame": 876,
      "t_ms": 38072,
      "move": "L'",
      "quat": [
        -0.505356,
        -0.6686,
        -0.512314,
        -0.187323
      ],
      "quality": {
        "tier": "A",
        "snr": 10.754636,
        "neighbor_gap": 31,
        "snapped": true
      },
      "motion_frame": 877,
      "ble_reported_state_index": 16
    },
    {
      "index": 13,
      "frame": 1057,
      "t_ms": 39552,
      "move": "D'",
      "quat": [
        -0.123539,
        -0.073305,
        -0.961852,
        0.232795
      ],
      "quality": {
        "tier": "A",
        "snr": 4.251274,
        "neighbor_gap": 121,
        "snapped": true
      },
      "motion_frame": 1057,
      "ble_reported_state_index": 15
    },
    {
      "index": 14,
      "frame": 1178,
      "t_ms": 40591,
      "move": "D",
      "quat": [
        -0.206397,
        0.551897,
        -0.802057,
        0.097385
      ],
      "quality": {
        "tier": "A",
        "snr": 7.417447,
        "neighbor_gap": 54,
        "snapped": true
      },
      "motion_frame": 1178,
      "ble_reported_state_index": 14
    },
    {
      "index": 15,
      "frame": 1232,
      "t_ms": 40993,
      "move": "L",
      "quat": [
        -0.162114,
        0.505112,
        -0.831904,
        0.162664
      ],
      "quality": {
        "tier": "A",
        "snr": 10.754636,
        "neighbor_gap": 33,
        "snapped": true
      },
      "motion_frame": 1232,
      "ble_reported_state_index": 15
    },
    {
      "index": 16,
      "frame": 1265,
      "t_ms": 41307,
      "move": "D",
      "quat": [
        -0.157933,
        0.53737,
        -0.815424,
        0.146062
      ],
      "quality": {
        "tier": "A",
        "snr": 4.932707,
        "neighbor_gap": 33,
        "snapped": true
      },
      "motion_frame": 1265,
      "ble_reported_state_index": 15
    },
    {
      "index": 17,
      "frame": 1300,
      "t_ms": 41531,
      "move": "L'",
      "quat": [
        -0.191259,
        0.536851,
        -0.803552,
        0.171697
      ],
      "quality": {
        "tier": "A",
        "snr": 6.4814,
        "neighbor_gap": 35,
        "snapped": true
      },
      "motion_frame": 1300,
      "ble_reported_state_index": 15
    },
    {
      "index": 18,
      "frame": 1363,
      "t_ms": 42072,
      "move": "D'",
      "quat": [
        -0.238716,
        0.521561,
        -0.788659,
        0.221259
      ],
      "quality": {
        "tier": "A",
        "snr": 4.041213,
        "neighbor_gap": 63,
        "snapped": true
      },
      "motion_frame": 1363,
      "ble_reported_state_index": 18
    },
    {
      "index": 19,
      "frame": 1439,
      "t_ms": 42751,
      "move": "D'",
      "quat": [
        -0.101749,
        0.552019,
        -0.808557,
        0.176397
      ],
      "quality": {
        "tier": "A",
        "snr": 10.754636,
        "neighbor_gap": 52,
        "snapped": true
      },
      "motion_frame": 1439,
      "ble_reported_state_index": 18
    },
    {
      "index": 20,
      "frame": 1491,
      "t_ms": 43152,
      "move": "L'",
      "quat": [
        -0.085604,
        0.561663,
        -0.806238,
        0.16483
      ],
      "quality": {
        "tier": "A",
        "snr": 10.754636,
        "neighbor_gap": 26,
        "snapped": true
      },